,Header,Summary,Detail,Link,Category,CreationDate,Pic_url
6,PSX ends nearly flat on profit-booking,"KSE-100 index creeps up 29.27 points, settles at 60,531.27","Pakistan Stock Exchange (PSX) on Thursday closed nearly flat as it crept up just 29 points owing to profit-taking by investors, which restricted the market from making big leap in line with the recent trend.
The KSE-100 index remained volatile despite the emergence of positive economic indicators in recent weeks. The rollover of $3 billion in Saudi deposits in the State Bank of Pakistan, increase in exports and remittances and court’s stay order against the collection of windfall tax from banks were among the encouraging factors.
“Stocks showed recovery amid rollover of $3 billion in Saudi deposits, fall in treasury bond yields and court’s stay against the recovery of over Rs35 billion in windfall tax from banks,” said Arif Habib Corp MD Ahsan Mehanti.
“Reports of surging exports, improving key economic indicators and easing geopolitical uncertainty also played the role of catalysts in positive close at the PSX.”
At close, the benchmark KSE-100 index recorded narrow gains of 29.27 points, or 0.05%, and settled at 60,531.27.
Topline Securities, in its report, wrote that the KSE-100 index opened on a positive note and touched the intra-day high of 480 points. However, sceptical investors turned to profit-booking, pulling the index down, which finally settled at 60,531, up 0.05%.
Major positive contributors were Millat Tractors, Lucky Cement, Hub Power, Fauji Fertiliser and Systems Limited, cumulatively adding 311 points to the index.
On the flip side, MCB Bank, Engro, United Bank, TRG Pakistan and Mari Petroleum dragged the index down by 254 points, it said.
The MSCI semi-annual rebalancing was observed during the day. There were no additions and deletions in the main MSCI Frontier Index. However, in its small-cap index, Agha Steel, AGP Limited, Pak Suzuki Motor and Sazgar Engineering were added whereas Faysal Bank, Kohat Cement, Maple Leaf Cement and Shell Pakistan were removed, Topline added.
Arif Habib Limited (AHL) noted that despite a whopping 16.5% month-on-month rise, the KSE-100 came down from all-time highs. “Seasonality factor remains favourable for higher stock prices into the end of January with the target at 65k,” it said.
Globally, Pakistan ranked the fifth strongest market with US dollar returns of 15.4% (after Argentina +33%, Israel +18%, South Korea +16% and Spain +15.5%).
November was a very strong month for foreign inflows with net buying of over $30 million, a number last seen in 2019, AHL said.
Key index movers were Millat Tractors (+7.5%), Lucky Cement (+4.03%) and Hub Power (+2.15%) while major drags were MCB Bank (-3.53%), Engro (-2.31%) and United Bank (-1.73%), it added.
JS Global analyst Mohammed Waqar Iqbal said that the bourse witnessed a range-bound activity as the KSE-100 index touched the high and low of 60,982 and 60,428 points, respectively.
“Going forward, we expect range-bound activity to continue and recommend investors to view any downtrend as an opportunity to buy stocks in cement and textile sectors,” the analyst added.
Overall trading volumes decreased to 467.2 million shares compared with Wednesday’s tally of 692.2 million. The value of shares traded during the day was Rs18.8 billion.
Shares of 379 companies were traded. Of these, 148 stocks closed higher, 212 dropped and 19 remained unchanged.
Fauji Foods was the volume leader with trading in 34.5 million shares, gaining Rs0.54 to close at Rs9.05. It was followed by Fauji Fertiliser Bin Qasim with 33.02 million shares, gaining Rs1.67 to close at Rs24 and WorldCall Telecom with 28.1 million shares, losing Rs0.02 to close at Rs1.51.
Foreign investors were net buyers of shares worth Rs1.14 billion, according to the NCCPL.
Published in The Express Tribune, December 1st, 2023.
Like Business on Facebook, follow @TribuneBiz on Twitter to stay informed and join in the conversation.
 
",https://tribune.com.pk/story/2448549/psx-ends-nearly-flat-on-profit-booking,business,2023-12-01,
7,Industrialists announce shutdown on Dec 4,Insist high gas tariffs make all industrial zones uncompetitive,"Industrialists of Karachi have announced a strike on December 4 to protest the whopping and unaffordable gas tariffs, which have made all seven industrial zones of the port city unviable and uncompetitive.
They have called for applying forthwith the reduced gas tariff of Rs1,350 per million British thermal units (mmBtu) determined by the Oil and Gas Regulatory Authority (Ogra).
Other industrialists and trade bodies of Sindh and Balochistan including the Lasbela Chamber of Commerce and Industry, Nooriabad, Kotri and Hyderabad had expressed their solidarity and fully supported a complete shutdown.
Speaking to journalists at a press conference held at the conference office of the SITE Association of Industry (SAI) on Thursday, the industrialists said it was the third press conference in a series of protests against the soaring rates of gas but no top government official or policymaker had approached the Karachi Chamber of Commerce and Industry to fix the problems.
They wore black armbands and banners were hanging on walls with demands that the government do justice with the industrialists of Karachi and Sindh.
“After a series of protests and press conferences, now we announce a complete closure of all industries on December 4 (Monday), if the legitimate demand of fixing gas tariff at Rs1,350 per mmBtu is not met by the government,” said an industry leader.
Only the industries of Karachi export $47.69 million (or Rs13,754 million) of goods per day. If industrial zones of the port city are closed just for one day, it will be a major loss to the national economy.
Businessmen had appealed to the government to reduce gas tariffs to Rs1,350 per mmBtu, which had been determined by Ogra as the 100% cost of gas including around 22% profit for Sui Southern Gas Company (SSGC), said Businessmen Group Vice Chairman Jawed Bilwani.
He said the new gas tariffs had burdened industries with a cross-subsidy for providing unfair support to fertiliser, power and domestic sectors.
Read: Industrialists denounce gas tariff hike
“The industry demands fair gas tariffs and will never accept the unbearable rates ranging from Rs2,100 to Rs2,600 per mmBtu, which have been imposed to please the fertiliser, domestic and power sectors, and penalise the industrial sector that forms the backbone of the economy,” he reiterated.
SAI President Muhammad Kamran Arbi urged the government to hold a meeting with industry stakeholders to reach consensus on gas prices since the existing tariffs had outgrown the manufacturing costs.
“If a small unit was paying a gas bill of Rs1 million, now it has to foot the bill of around Rs2 million. Around 71 industrialists of the SAI have approached and informed me that they are unable to run their units in the current economic crisis,” he revealed.
Arbi said the business community expected the promised winter package for incremental consumption of electricity as it was agreed to provide electricity at a reduced tariff of Rs20 per unit on incremental consumption during four months of winter.
Federal B Area Association of Trade and Industry (FBATI) President Syed Raza Hussain said high tariffs took a heavy toll on small and medium-sized enterprises (SMEs), which had started reducing their operations.
“If a factory used to run three shifts, it is now running two shifts. SMEs can be closed gradually and workers will be rendered unemployed,” he added.
Earlier, a large number of industry workers protested outside the SAI.
Published in The Express Tribune, December 1st, 2023.
Like Business on Facebook, follow @TribuneBiz on Twitter to stay informed and join in the conversation.
 
",https://tribune.com.pk/story/2448555/industrialists-announce-shutdown-on-dec-4,business,2023-12-01,
8,Saudi loan rollover props up rupee,Currency reaches one-week high at Rs285.17 to a dollar,"Pakistani currency on Thursday edged up to a one-week high at slightly above Rs285 against the US dollar in the inter-bank market on the back of some improvement in foreign currency inflows in the country.
A day ago, Saudi Arabia rolled over its $3 billion in deposits at the State Bank of Pakistan (SBP) for another year by the end of December 2024.
Pakistan was liable to repay the funds to the kingdom next month but the rollover is expected to ensure the much-needed stability in the country’s foreign exchange reserves. Owing to that, Pakistani rupee got vital support versus the greenback.
According to SBP’s data, the domestic currency inched up 0.08%, or Rs0.22, and closed at Rs285.17 against the dollar.
Market talk revealed that the currency had briefly recovered to Rs284.72/$ at a point in time, but closed comparatively lower around Rs285/$.
The rupee has hovered around that level for almost two weeks now. Thursday was the third consecutive working day for the uptick in the currency.
Market players observed some political instability associated with the upcoming general elections scheduled for February 2024.
Read: Saudi Arabia extends term of $3b deposit for another year
In the open market, the rupee regained 0.17%, or Rs0.50, and settled at Rs286.50 against the greenback, according to the Exchange Companies Association of Pakistan.
The currency also remained stable as foreign corporate investors returned to the Pakistan Stock Exchange (PSX), who made cumulative net buying of $15 million in the past four successive sessions, an investment that was witnessed after quite a long time.
In the entire month of November, they injected a net $31 million into the PSX, lending critical support to Pakistan’s foreign exchange reserves and stabilising the rupee.
A slight drop in cut-off yields of government’s T-bills ranging from five to seven basis points in addition to the earlier decline also indirectly boosted the confidence of importers in the currency.
Published in The Express Tribune, December 1st, 2023.
Like Business on Facebook, follow @TribuneBiz on Twitter to stay informed and join in the conversation.
 
",https://tribune.com.pk/story/2448556/saudi-loan-rollover-props-up-rupee,business,2023-12-01,
